{
  "id": "00000000-0000-0000-0000-000000000004",
  "workspace_id": "00000000-0000-0000-0000-000000000001",
  "project_id": "00000000-0000-0000-0000-000000000003",
  "type": "milestone",
  "version": 1,
  "archived": false,
  "goal": "合成目標",
  "acceptance": "合成の完了条件",
  "assignee_id": "00000000-0000-0000-0000-000000000002",
  "check_date": "",
  "state": "待ち"
}
